{
    "$schema": "./schema.json",
    "id": "teapot",
    "version": "1.0",
    "metadata": {
        "icon": "ðŸ«–",
        "label": "Teapot",
        "description": "Classic teapot with decorative decals, gold metallic accents, and procedural textures.",
        "type": "object",
        "defaultLighting": "studio",
        "defaultCamera": "front"
    },
    "transform": {
        "position": [
            0,
            0.5,
            0
        ],
        "rotation": [
            0,
            0,
            0
        ],
        "scale": [
            1,
            1,
            1
        ]
    },
    "materials": {
        "main": {
            "type": "physical",
            "color": "#6366f1",
            "metalness": 0.1,
            "roughness": 0.3,
            "clearcoat": 1.0,
            "clearcoatRoughness": 0.1,
            "texture": {
                "type": "procedural",
                "generator": "teapotDecal",
                "size": [
                    512,
                    512
                ]
            }
        },
        "metal": {
            "type": "physical",
            "color": "#ffd700",
            "metalness": 0.9,
            "roughness": 0.2
        }
    },
    "children": [
        {
            "name": "body",
            "geometry": {
                "type": "sphere",
                "radius": 1,
                "widthSegments": 64,
                "heightSegments": 64,
                "scale": [
                    1,
                    0.7,
                    1
                ]
            },
            "material": "main",
            "castShadow": true
        },
        {
            "name": "lidBase",
            "geometry": {
                "type": "cylinder",
                "radiusTop": 0.45,
                "radiusBottom": 0.5,
                "height": 0.15,
                "radialSegments": 32
            },
            "material": "metal",
            "transform": {
                "position": [
                    0,
                    0.65,
                    0
                ]
            }
        },
        {
            "name": "lid",
            "geometry": {
                "type": "sphere",
                "radius": 0.45,
                "widthSegments": 32,
                "heightSegments": 16,
                "phiStart": 0,
                "phiLength": 6.283185,
                "thetaStart": 0,
                "thetaLength": 1.5708
            },
            "material": "main",
            "transform": {
                "position": [
                    0,
                    0.72,
                    0
                ]
            }
        },
        {
            "name": "knob",
            "geometry": {
                "type": "sphere",
                "radius": 0.1,
                "widthSegments": 16,
                "heightSegments": 16
            },
            "material": "metal",
            "transform": {
                "position": [
                    0,
                    1.15,
                    0
                ]
            }
        },
        {
            "name": "spout",
            "geometry": {
                "type": "cylinder",
                "radiusTop": 0.08,
                "radiusBottom": 0.15,
                "height": 0.8,
                "radialSegments": 16
            },
            "material": "main",
            "transform": {
                "position": [
                    1.0,
                    0.2,
                    0
                ],
                "rotation": [
                    0,
                    0,
                    -0.7854
                ]
            }
        },
        {
            "name": "spoutTip",
            "geometry": {
                "type": "cylinder",
                "radiusTop": 0.06,
                "radiusBottom": 0.08,
                "height": 0.2,
                "radialSegments": 16
            },
            "material": "metal",
            "transform": {
                "position": [
                    1.35,
                    0.55,
                    0
                ],
                "rotation": [
                    0,
                    0,
                    -0.7854
                ]
            }
        },
        {
            "name": "handle",
            "geometry": {
                "type": "torus",
                "radius": 0.4,
                "tube": 0.08,
                "radialSegments": 16,
                "tubularSegments": 32,
                "arc": 3.14159
            },
            "material": "metal",
            "transform": {
                "position": [
                    -0.95,
                    0.2,
                    0
                ],
                "rotation": [
                    0,
                    1.5708,
                    1.5708
                ]
            }
        },
        {
            "name": "rim",
            "geometry": {
                "type": "torus",
                "radius": 0.6,
                "tube": 0.08,
                "radialSegments": 16,
                "tubularSegments": 32
            },
            "material": "metal",
            "transform": {
                "position": [
                    0,
                    -0.6,
                    0
                ],
                "rotation": [
                    1.5708,
                    0,
                    0
                ]
            }
        }
    ]
}